2172:42328, ack 37, win 501, length 156
22:05:57.480976 IP 165.22.237.185.22 > 198.96.84.204.53986: Flags [P.], seq 42328:42484, ack 37, win 501, length 156
22:05:57.481090 IP 165.22.237.185.22 > 198.96.84.204.53986: Flags [P.], seq 42484:42856, ack 37, win 501, length 372
22:05:57.481130 IP 165.22.237.185.22 > 198.96.84.204.53986: Flags [P.], seq 42856:42892, ack 37, win 501, length 36
22:05:57.487209 IP 198.96.84.204.53986 > 165.22.237.185.22: Flags [.], ack 42892, win 511, length 0
22:05:57.584892 IP 165.22.237.185.22 > 198.96.84.204.53986: Flags [P.], seq 42892:43048, ack 37, win 501, length 156
22:05:57.585003 IP 165.22.237.185.22 > 198.96.84.204.53986: Flags [P.], seq 43048:43540, ack 37, win 501, length 492
22:05:57.591441 IP 198.96.84.204.53986 > 165.22.237.185.22: Flags [.], ack 43540, win 509, length 0
22:05:57.688864 IP 165.22.237.185.22 > 198.96.84.204.53986: Flags [P.], seq 43540:43696, ack 37, win 501, length 156
22:05:57.688956 IP 165.22.237.185.22 > 198.96.84.204.53986: Flags [P.], seq 43696:43956, ack 37, win 501, length 260
22:05:57.696803 IP 198.96.84.204.53986 > 165.22.237.185.22: Flags [.], ack 43956, win 507, length 0
22:05:57.792892 IP 165.22.237.185.22 > 198.96.84.204.53986: Flags [P.], seq 43956:44112, ack 37, win 501, length 156
22:05:57.792987 IP 165.22.237.185.22 > 198.96.84.204.53986: Flags [P.], seq 44112:44372, ack 37, win 501, length 260
22:05:57.800271 IP 198.96.84.204.53986 > 165.22.237.185.22: Flags [.], ack 44372, win 511, length 0
22:05:57.896869 IP 165.22.237.185.22 > 198.96.84.204.53986: Flags [P.], seq 44372:44528, ack 37, win 501, length 156
22:05:57.896965 IP 165.22.237.185.22 > 198.96.84.204.53986: Flags [P.], seq 44528:44788, ack 37, win 501, length 260
22:05:57.903659 IP 198.96.84.204.53986 > 165.22.237.185.22: Flags [.], ack 44788, win 510, length 0
^C
304 packets captured
309 packets received by filter
0 packets dropped by kernel
