root@comp3134-Winter2025:~# tcpdump -c 5 -i eth0
tcpdump: verbose output suppressed, use -v[v]... for full protocol decode
listening on eth0, link-type EN10MB (Ethernet), snapshot length 262144 bytes
21:58:13.481534 IP comp3134-Winter2025.ssh > 198.96.84.204.53986: Flags [P.], seq 3670456534:3670456586, ack 3198043890, win 501, length 52
21:58:13.483292 IP comp3134-Winter2025.ssh > 198.96.84.204.53986: Flags [P.], seq 52:160, ack 1, win 501, length 108
21:58:13.483340 IP comp3134-Winter2025.ssh > 198.96.84.204.53986: Flags [P.], seq 160:196, ack 1, win 501, length 36
21:58:13.483374 IP comp3134-Winter2025.ssh > 198.96.84.204.53986: Flags [P.], seq 196:248, ack 1, win 501, length 52
21:58:13.483405 IP comp3134-Winter2025.ssh > 198.96.84.204.53986: Flags [P.], seq 248:316, ack 1, win 501, length 68
5 packets captured
26 packets received by filter
0 packets dropped by kernel
root@comp3134-Winter2025:~#
