
root@comp3134-Winter2025:~# tcpdump -i eth0 dst 165.22.237.185
tcpdump: verbose output suppressed, use -v[v]... for full protocol decode
listening on eth0, link-type EN10MB (Ethernet), snapshot length 262144 bytes
22:10:42.809859 IP 198.96.84.204.53986 > comp3134-Winter2025.ssh: Flags [.], ack 3695389878, win 511, length 0
22:10:42.902449 IP 67.207.67.3.domain > comp3134-Winter2025.41869: 11658 NXDomain 0/1/1 (123)
22:10:42.902824 IP 67.207.67.3.domain > comp3134-Winter2025.41869: 11658 NXDomain 0/1/0 (112)
22:10:42.903590 IP 67.207.67.3.domain > comp3134-Winter2025.43141: 40853 NXDomain 0/1/1 (120)
22:10:42.903651 IP 67.207.67.3.domain > comp3134-Winter2025.36474: 29246 NXDomain 0/1/1 (120)
22:10:42.903915 IP 67.207.67.3.domain > comp3134-Winter2025.43141: 40853 NXDomain 0/1/0 (109)
22:10:42.903916 IP 67.207.67.3.domain > comp3134-Winter2025.36474: 29246 NXDomain 0/1/0 (109)
22:10:42.904408 IP 67.207.67.3.domain > comp3134-Winter2025.46854: Flags [S.], seq 3318007715, ack 2936880902, win 65160, options [mss 1460,sackOK,TS val 2724587701 ecr 1019645313,nop,wscale 9], length 0
22:10:42.904713 IP 67.207.67.3.domain > comp3134-Winter2025.46854: Flags [.], ack 47, win 128, options [nop,nop,TS val 2724587702 ecr 1019645314], length 0
22:10:42.904968 IP 67.207.67.3.domain > comp3134-Winter2025.46854: Flags [P.], seq 1:112, ack 47, win 128, options [nop,nop,TS val 2724587702 ecr 1019645314], length 111 36956 NXDomain 0/1/0 (109)
22:10:42.914220 IP 198.96.84.204.53986 > comp3134-Winter2025.ssh: Flags [.], ack 185, win 511, length 0
22:10:43.005489 IP 67.207.67.3.domain > comp3134-Winter2025.56900: 49259 NXDomain 0/1/1 (120)
22:10:43.005596 IP 67.207.67.3.domain > comp3134-Winter2025.33295: 3668 NXDomain 0/1/1 (120)
22:10:43.005703 IP 67.207.67.3.domain > comp3134-Winter2025.46854: Flags [P.], seq 112:223, ack 91, win 128, options [nop,nop,TS val 2724587803 ecr 1019645415], length 111 28141 NXDomain 0/1/0 (109)
22:10:43.005760 IP 67.207.67.3.domain > comp3134-Winter2025.56900: 49259 NXDomain 0/1/0 (109)
22:10:43.005840 IP 67.207.67.3.domain > comp3134-Winter2025.33295: 3668 NXDomain 0/1/0 (109)
22:10:43.014300 IP 198.96.84.204.53986 > comp3134-Winter2025.ssh: Flags [.], ack 1705, win 511, length 0
22:10:43.022009 IP 198.96.84.204.53986 > comp3134-Winter2025.ssh: Flags [.], ack 2153, win 510, length 0
22:10:43.022009 IP 198.96.84.204.53986 > comp3134-Winter2025.ssh: Flags [P.], seq 0:36, ack 2153, win 510, length 36
22:10:43.118937 IP 198.96.84.204.53986 > comp3134-Winter2025.ssh: Flags [.], ack 3641, win 511, length 0
22:10:43.217906 IP 198.96.84.204.53986 > comp3134-Winter2025.ssh: Flags [.], ack 3817, win 511, length 0
22:10:43.321981 IP 198.96.84.204.53986 > comp3134-Winter2025.ssh: Flags [.], ack 3993, win 510, length 0
22:10:43.480168 IP 198.96.84.204.53986 > comp3134-Winter2025.ssh: Flags [.], ack 4133, win 510, length 0
22:10:43.573671 IP 198.96.84.204.53986 > comp3134-Winter2025.ssh: Flags [.], ack 4273, win 509, length 0
22:10:43.684072 IP 198.96.84.204.53986 > comp3134-Winter2025.ssh: Flags [.], ack 4413, win 508, length 0
22:10:43.779052 IP 198.96.84.204.53986 > comp3134-Winter2025.ssh: Flags [.], ack 4553, win 508, length 0
22:10:43.888201 IP 198.96.84.204.53986 > comp3134-Winter2025.ssh: Flags [.], ack 4693, win 507, length 0
^C
27 packets captured
30 packets received by filter
0 packets dropped by kernel
root@comp3134-Winter2025:~#
