# tcpdump -i eth0 src 165.22.237.185

22:13:12.365007 IP comp3134-Winter2025.ssh > 198.96.84.204.53986: Flags [P.], seq 10896:11060, ack 1, win 501, length 164
22:13:12.468974 IP comp3134-Winter2025.ssh > 198.96.84.204.53986: Flags [P.], seq 11060:11224, ack 1, win 501, length 164
22:13:12.572925 IP comp3134-Winter2025.ssh > 198.96.84.204.53986: Flags [P.], seq 11224:11388, ack 1, win 501, length 164
22:13:12.676928 IP comp3134-Winter2025.ssh > 198.96.84.204.53986: Flags [P.], seq 11388:11552, ack 1, win 501, length 164
^C
72 packets captured
74 packets received by filter
0 packets dropped by kernel
root@comp3134-Winter2025:~#
